{
    "$id": "https://example.com/equations.schema.json",
    "$schema": "https://json-schema.org/draft/2020-12/schema",
    "description": "Schema for equations and related components",
    "type": "object",
    "properties": {
      "SystemId": { "type": "string" },
      "Name": { "type": "string" },
      "description": { "type": "string" },
      "inputs": {
        "type": "array",
        "items": { "$ref": "#/$defs/input" }
      },
      "states": {
        "type": "array",
        "items": { "$ref": "#/$defs/state" }
      }
    },
    "required": ["SystemId", "Name", "description", "inputs", "states"],
    "$defs": {
      "input": {
        "type": "object",
        "properties": {
          "name": { "type": "string" },
          "value": { "type": "string" },
          "type": { "type": "string" },
          "enum_values": {
            "type": "array",
            "items": { "type": "string" }
          },
          "required": { "type": "boolean" },
          "unit": { "type": "string" }
        },
        "required": ["name", "value", "type", "required"]
      },
      "state": {
        "type": "object",
        "properties": {
          "name": { "type": "string" },
          "type": { "type": "string" },
          "transitions": {
            "type": "array",
            "items": { "$ref": "#/$defs/transition" }
          },
          "equation": { "type": "string" },
          "value": { "type": "string" },
          "unit": { "type": "string" },
          "description": { "type": "string" }
        },
        "required": ["name", "type"]
      },
      "transition": {
        "type": "object",
        "properties": {
          "conditions": { "type": "string" },
          "next_step": { "type": "string" }
        },
        "required": ["next_step"]
      }
    }
  }