{
    "SystemId": "MDCalc 1",
    "Name": "LDL Cholesterol Calculation",
    "description": "Calculates LDL based on total cholesterol, HDL cholesterol, and triglycerides using the Friedewald formula.",
    "inputs": [
        {
            "name": "total_cholesterol",
            "unit": "mg/dL",
            "value": "180",
            "type": "float",
            "required": true
        },
        {
            "name": "hdl_cholesterol",
            "unit": "mg/dL",
            "value": "80",
            "type": "float",
            "required": true
        },
        {
            "name": "triglycerides",
            "unit": "mg/dL",
            "value": "100",
            "type": "float",
            "required": true
        }
    ],
    "states": [
        {
            "name": "calculate_ldl",
            "type": "calculation",
            "equation": "$LDL$ = $total_cholesterol$ - $hdl_cholesterol$ - ($triglycerides$ / 5.0)",
            "transitions": [
                {
                    "next_step" : "LDL_Calculated_output"
                }
            ]
        },
        {
            "name": "LDL_Calculated_output",
            "type" : "output",
            "unit": "mg/dL",
            "description": "Calculated LDL level using the Friedewald formula."
        }
    ]
}
